{
  "Computer": "SRV-APP-01",
  "ScannedAtUtc": "2026-04-30T14:32:18Z",
  "ScannedBy": "DOMAIN\\msvc",
  "Status": "Success",
  "DurationSeconds": 47.3,
  "CollectedSections": ["System","Hardware","Disks","Network","InstalledApplications","ChocolateyPackages","WindowsFeatures","Permissions","Services","Shares","ScheduledTasks","LocalUsers","FirewallRules","Iis","Certificates","Chef","SqlServer"],
  "System": {
    "OsCaption": "Microsoft Windows Server 2019 Standard",
    "OsVersion": "10.0.17763",
    "OsBuild": "17763.5458",
    "InstallDateUtc": "2021-03-12T08:14:00Z",
    "LastBootUtc": "2026-04-22T03:11:00Z",
    "LastHotfix": { "HotFixId": "KB5037765", "InstalledOnUtc": "2026-04-12T00:00:00Z" },
    "Domain": "corp.contoso.com",
    "TimeZone": "W. Europe Standard Time",
    "WinRmHttpsCertThumbprint": null
  },
  "Hardware": { "CpuModel": "Xeon", "CpuSockets": 2, "CpuLogicalCores": 16, "MemoryTotalGB": 64.0 },
  "Disks": [{ "Drive": "C:", "Label": "OS", "FileSystem": "NTFS", "TotalGB": 100.0, "FreeGB": 32.4, "UsedPct": 67.6 }],
  "Network": { "Hostname": "SRV-APP-01", "Fqdn": "SRV-APP-01.corp.contoso.com", "Adapters": [] },
  "InstalledApplications": [],
  "ChocolateyPackages": [],
  "WindowsFeatures": [],
  "Permissions": { "Administrators": [], "RemoteDesktopUsers": [], "RemoteManagementUsers": [] },
  "Services": [],
  "Shares": [],
  "ScheduledTasks": [],
  "ServiceAccounts": [],
  "LocalUsers": [],
  "FirewallRules": [],
  "Iis": null,
  "Certificates": [],
  "Chef": null,
  "SqlServer": null,
  "Errors": []
}
